{
  "campaign_definition_fingerprint": "sha256:98d0b9852fa277dc5b164fe14a3711b50be2a72ea5f5fca5ed0dd09fe8072566",
  "campaign_experiment_fingerprints": {
    "browser_configs": "sha256:591cbc3aa572200862e2f336261f05849fe93c17d226a939565815d0cb075961",
    "campaign_definition": "sha256:98d0b9852fa277dc5b164fe14a3711b50be2a72ea5f5fca5ed0dd09fe8072566",
    "prompt_registry_state": "sha256:d409ed75b3cb355ac6727f09877d7ef98c40adce16e3e8284c6dcfe9c5c3db21",
    "provider_configs": "sha256:69c4ef3c9876f8d46bd609d755baa1bb850cd8d9fdcbdee0748b6e10c36cf5f1",
    "scoring_configs": "sha256:2c7f1b6d79305cde67076936152d80992802d413157de43143bac86c13c21fc8",
    "suite_definitions": "sha256:d2b3773206bf3494af78922b52603f56a48e60aea74a7f40998fc98adbafbeca"
  },
  "campaign_id": "campaign.examples.multi_suite.v1",
  "campaign_version": "1.0.0",
  "created_at": "1970-01-01T00:00:00Z",
  "definition_source_relpath": "examples/campaigns/v1/multi_suite.v1.yaml",
  "dry_run": false,
  "failures": [],
  "fixture_mode_force_mock": true,
  "git_commit_sha": "1d6cbf5bc0c399ea757e6b38add5f4db5f10d102",
  "git_describe": "v0.2.3-dirty",
  "run_count": 2,
  "run_status_summary": {
    "failed": 0,
    "succeeded": 2
  },
  "runs": [
    {
      "benchmark_id": "bench.fixtures.campaign.micro.v1",
      "browser_config_applied": false,
      "cell_count": 1,
      "comparison_fingerprints": {
        "browser_config": "sha256:0801b86094b64df0a6e4bb551818c221b30cdd4410397056547e695d3e75c9db",
        "prompt_registry_state": "sha256:9604a174787655177b3c8c0e634e5a80348399f090bc741cac5825a8a5b128f2",
        "prompt_set": "sha256:5939745c0633bdffb37cd1491e722b6375fdd7b7ca27da391e0ac9035252a1b7",
        "provider_config": "sha256:4fbcb71d4546d6de7a19213a0a060a65b4c35192a1afb41b7016bedf3d728498",
        "scoring_config": "sha256:f958bcbda76ceda7438ca44922ecf99f6ef81948463ec797c7b454a29b249496",
        "suite_definition": "sha256:c42296d7793f46e3d63e40015894250a95e6923553c47f9fef0f81c9337ba2db"
      },
      "duration_seconds": 0.003366,
      "eval_scoring_label": "suite_default",
      "manifest_relpath": "runs/run0000/manifest.json",
      "mean_total_weighted_score": 0.667276,
      "output_relpath": "runs/run0000",
      "run_id": "campaign.examples.multi_suite.v1__0000",
      "run_index": 0,
      "status": "succeeded",
      "suite_ref": "fixtures/benchmarks/campaign_micro.v1.yaml"
    },
    {
      "benchmark_id": "bench.offline.v1",
      "browser_config_applied": false,
      "cell_count": 6,
      "comparison_fingerprints": {
        "browser_config": "sha256:ed3546eca3742a5cf3c4a1b3cacd8d196bb634303b027d2f15dc708763fb4a6e",
        "prompt_registry_state": "sha256:9604a174787655177b3c8c0e634e5a80348399f090bc741cac5825a8a5b128f2",
        "prompt_set": "sha256:102459cb2d6cf18c1aa267c534df7ba3c09c789c5e96bd7e64a02115528f93b0",
        "provider_config": "sha256:c26e5aa1062dd8044ff05406c4307c61d9e46a08d7627b6e20ff47b7847181bc",
        "scoring_config": "sha256:f958bcbda76ceda7438ca44922ecf99f6ef81948463ec797c7b454a29b249496",
        "suite_definition": "sha256:52bf51382310147547bbcf152c5c4eab362af0f2595fad08226395a5ce9c9996"
      },
      "duration_seconds": 0.008417,
      "eval_scoring_label": "suite_default",
      "manifest_relpath": "runs/run0001/manifest.json",
      "mean_total_weighted_score": 0.36725116666666663,
      "output_relpath": "runs/run0001",
      "run_id": "campaign.examples.multi_suite.v1__0001",
      "run_index": 1,
      "status": "succeeded",
      "suite_ref": "fixtures/benchmarks/offline.v1.yaml"
    }
  ],
  "schema_version": 1,
  "title": "Example \u2014 multi-suite sweep (two fixtures)"
}
